[
 {
  "moment_id": "mo_0001",
  "t": 15.59,
  "clock": 15.59,
  "minute": 1,
  "type": "hard_pass",
  "class": 3,
  "score": 0.5,
  "team": "CRV",
  "players": [
   "p_126",
   "p_128"
  ],
  "evidence": [
   "ev_000007"
  ],
  "facts": {
   "passer": "Bram Ekpo",
   "receiver": "Somto Odum",
   "team": "CRV",
   "difficulty": 4,
   "distance_m": 32,
   "completion_chance_pct": 57
  }
 },
 {
  "moment_id": "mo_0002",
  "t": 52.18,
  "clock": 52.18,
  "minute": 1,
  "type": "high_turnover",
  "class": 2,
  "score": 0.52,
  "team": "CRV",
  "players": [
   "p_128"
  ],
  "evidence": [
   "ev_000020"
  ],
  "facts": {
   "player": "Somto Odum",
   "team": "CRV",
   "won_by": "interception",
   "metres_from_goal": 8,
   "turnovers_in_final_third_last_5min": 1
  }
 },
 {
  "moment_id": "mo_0003",
  "t": 86.92,
  "clock": 86.92,
  "minute": 2,
  "type": "milestone",
  "class": 3,
  "score": 0.35,
  "team": "OST",
  "players": [
   "p_146"
  ],
  "evidence": [
   "ev_000034"
  ],
  "facts": {
   "team": "OST",
   "player": "Jide Okeke",
   "first_shot_on_target_of_match": true
  }
 },
 {
  "moment_id": "mo_0004",
  "t": 299.79,
  "clock": 299.79,
  "minute": 5,
  "type": "long_move",
  "class": 3,
  "score": 0.4,
  "team": "CRV",
  "players": [
   "p_124"
  ],
  "evidence": [
   "ev_000100",
   "ev_000101",
   "ev_000102",
   "ev_000103",
   "ev_000104",
   "ev_000105",
   "ev_000107",
   "ev_000108",
   "ev_000109",
   "ev_000110"
  ],
  "facts": {
   "team": "CRV",
   "passes_in_move": 10,
   "seconds_in_possession": 38
  }
 },
 {
  "moment_id": "mo_0005",
  "t": 341.37,
  "clock": 341.37,
  "minute": 6,
  "type": "long_move",
  "class": 3,
  "score": 0.4,
  "team": "OST",
  "players": [
   "p_143"
  ],
  "evidence": [
   "ev_000114",
   "ev_000115",
   "ev_000116",
   "ev_000117",
   "ev_000118",
   "ev_000119",
   "ev_000120",
   "ev_000121",
   "ev_000122",
   "ev_000123"
  ],
  "facts": {
   "team": "OST",
   "passes_in_move": 10,
   "seconds_in_possession": 37
  }
 },
 {
  "moment_id": "mo_0006",
  "t": 377.22,
  "clock": 377.22,
  "minute": 7,
  "type": "hard_pass",
  "class": 3,
  "score": 0.5,
  "team": "CRV",
  "players": [
   "p_125",
   "p_127"
  ],
  "evidence": [
   "ev_000134"
  ],
  "facts": {
   "passer": "Uche Saltire",
   "receiver": "Lanre Varga",
   "team": "CRV",
   "difficulty": 4,
   "distance_m": 22,
   "completion_chance_pct": 63
  }
 },
 {
  "moment_id": "mo_0007",
  "t": 397.31,
  "clock": 397.31,
  "minute": 7,
  "type": "high_turnover",
  "class": 2,
  "score": 0.52,
  "team": "CRV",
  "players": [
   "p_129"
  ],
  "evidence": [
   "ev_000143"
  ],
  "facts": {
   "player": "Dayo Okwu",
   "team": "CRV",
   "won_by": "interception",
   "metres_from_goal": 10,
   "turnovers_in_final_third_last_5min": 1
  }
 },
 {
  "moment_id": "mo_0008",
  "t": 437.01,
  "clock": 437.01,
  "minute": 8,
  "type": "big_chance",
  "class": 2,
  "score": 0.94,
  "team": "CRV",
  "players": [
   "p_128"
  ],
  "evidence": [
   "ev_000161"
  ],
  "facts": {
   "shooter": "Somto Odum",
   "team": "CRV",
   "outcome": "blocked",
   "chance_quality_pct": 39,
   "shot_distance_m": 3
  }
 },
 {
  "moment_id": "mo_0009",
  "t": 451.48,
  "clock": 451.48,
  "minute": 8,
  "type": "high_turnover",
  "class": 2,
  "score": 0.66,
  "team": "CRV",
  "players": [
   "p_125"
  ],
  "evidence": [
   "ev_000143",
   "ev_000155",
   "ev_000168"
  ],
  "facts": {
   "player": "Uche Saltire",
   "team": "CRV",
   "won_by": "interception",
   "metres_from_goal": 21,
   "turnovers_in_final_third_last_5min": 3
  }
 },
 {
  "moment_id": "mo_0010",
  "t": 531.38,
  "clock": 531.38,
  "minute": 9,
  "type": "high_turnover",
  "class": 2,
  "score": 0.73,
  "team": "CRV",
  "players": [
   "p_127"
  ],
  "evidence": [
   "ev_000143",
   "ev_000155",
   "ev_000168",
   "ev_000202"
  ],
  "facts": {
   "player": "Lanre Varga",
   "team": "CRV",
   "won_by": "interception",
   "metres_from_goal": 26,
   "turnovers_in_final_third_last_5min": 4
  }
 },
 {
  "moment_id": "mo_0011",
  "t": 643.25,
  "clock": 643.25,
  "minute": 11,
  "type": "hard_pass",
  "class": 3,
  "score": 0.5,
  "team": "CRV",
  "players": [
   "p_125",
   "p_128"
  ],
  "evidence": [
   "ev_000235"
  ],
  "facts": {
   "passer": "Uche Saltire",
   "receiver": "Somto Odum",
   "team": "CRV",
   "difficulty": 4,
   "distance_m": 17,
   "completion_chance_pct": 65
  }
 },
 {
  "moment_id": "mo_0012",
  "t": 854.32,
  "clock": 854.32,
  "minute": 15,
  "type": "high_turnover",
  "class": 2,
  "score": 0.52,
  "team": "OST",
  "players": [
   "p_147"
  ],
  "evidence": [
   "ev_000304"
  ],
  "facts": {
   "player": "Wale Halloran",
   "team": "OST",
   "won_by": "interception",
   "metres_from_goal": 24,
   "turnovers_in_final_third_last_5min": 1
  }
 },
 {
  "moment_id": "mo_0013",
  "t": 951.9,
  "clock": 951.9,
  "minute": 16,
  "type": "long_move",
  "class": 3,
  "score": 0.4,
  "team": "OST",
  "players": [
   "p_144"
  ],
  "evidence": [
   "ev_000331",
   "ev_000332",
   "ev_000333",
   "ev_000334",
   "ev_000335",
   "ev_000336",
   "ev_000337",
   "ev_000338",
   "ev_000339",
   "ev_000340"
  ],
  "facts": {
   "team": "OST",
   "passes_in_move": 10,
   "seconds_in_possession": 35
  }
 },
 {
  "moment_id": "mo_0014",
  "t": 955.73,
  "clock": 955.73,
  "minute": 16,
  "type": "hard_pass",
  "class": 3,
  "score": 0.5,
  "team": "OST",
  "players": [
   "p_147",
   "p_146"
  ],
  "evidence": [
   "ev_000341"
  ],
  "facts": {
   "passer": "Wale Halloran",
   "receiver": "Jide Okeke",
   "team": "OST",
   "difficulty": 4,
   "distance_m": 23,
   "completion_chance_pct": 65
  }
 },
 {
  "moment_id": "mo_0015",
  "t": 961.66,
  "clock": 961.66,
  "minute": 17,
  "type": "sprint",
  "class": 3,
  "score": 0.25,
  "team": "OST",
  "players": [
   "p_147"
  ],
  "evidence": [
   "ev_000343"
  ],
  "facts": {
   "player": "Wale Halloran",
   "team": "OST",
   "speed_kmh": 30.2
  }
 },
 {
  "moment_id": "mo_0016",
  "t": 987.86,
  "clock": 987.86,
  "minute": 17,
  "type": "drought",
  "class": 3,
  "score": 0.35,
  "team": "OST",
  "players": [],
  "evidence": [
   "ev_000356"
  ],
  "facts": {
   "team": "OST",
   "minutes_without_a_shot": 15
  }
 },
 {
  "moment_id": "mo_0017",
  "t": 1047.15,
  "clock": 1047.15,
  "minute": 18,
  "type": "long_move",
  "class": 3,
  "score": 0.4,
  "team": "OST",
  "players": [
   "p_138"
  ],
  "evidence": [
   "ev_000370",
   "ev_000371",
   "ev_000372",
   "ev_000373",
   "ev_000374",
   "ev_000375",
   "ev_000376",
   "ev_000377",
   "ev_000378",
   "ev_000379"
  ],
  "facts": {
   "team": "OST",
   "passes_in_move": 10,
   "seconds_in_possession": 33
  }
 },
 {
  "moment_id": "mo_0018",
  "t": 1099.04,
  "clock": 1099.04,
  "minute": 19,
  "type": "hard_pass",
  "class": 3,
  "score": 0.5,
  "team": "CRV",
  "players": [
   "p_125",
   "p_128"
  ],
  "evidence": [
   "ev_000395"
  ],
  "facts": {
   "passer": "Uche Saltire",
   "receiver": "Somto Odum",
   "team": "CRV",
   "difficulty": 4,
   "distance_m": 27,
   "completion_chance_pct": 65
  }
 },
 {
  "moment_id": "mo_0019",
  "t": 1168.36,
  "clock": 1168.36,
  "minute": 20,
  "type": "long_move",
  "class": 3,
  "score": 0.4,
  "team": "CRV",
  "players": [
   "p_128"
  ],
  "evidence": [
   "ev_000407",
   "ev_000408",
   "ev_000409",
   "ev_000410",
   "ev_000412",
   "ev_000413",
   "ev_000414",
   "ev_000415",
   "ev_000416",
   "ev_000420"
  ],
  "facts": {
   "team": "CRV",
   "passes_in_move": 10,
   "seconds_in_possession": 45
  }
 },
 {
  "moment_id": "mo_0020",
  "t": 1212.22,
  "clock": 1212.22,
  "minute": 21,
  "type": "sprint",
  "class": 3,
  "score": 0.25,
  "team": "OST",
  "players": [
   "p_146"
  ],
  "evidence": [
   "ev_000434"
  ],
  "facts": {
   "player": "Jide Okeke",
   "team": "OST",
   "speed_kmh": 30.2
  }
 },
 {
  "moment_id": "mo_0021",
  "t": 1212.22,
  "clock": 1212.22,
  "minute": 21,
  "type": "momentum_swing",
  "class": 2,
  "score": 0.55,
  "team": "CRV",
  "players": [],
  "evidence": [
   "ev_000346",
   "ev_000352",
   "ev_000362",
   "ev_000383",
   "ev_000405"
  ],
  "facts": {
   "team": "CRV",
   "shots_last_5min": 0,
   "opponent_shots_last_5min": 0,
   "turnovers_won_final_third_last_5min": 0,
   "passes_last_5min": 21,
   "opponent_passes_last_5min": 39
  }
 },
 {
  "moment_id": "mo_0022",
  "t": 1285.96,
  "clock": 1285.96,
  "minute": 22,
  "type": "press_change",
  "class": 3,
  "score": 0.4,
  "team": "OST",
  "players": [],
  "evidence": [
   "ev_000408",
   "ev_000409",
   "ev_000410",
   "ev_000440",
   "ev_000441"
  ],
  "facts": {
   "team": "OST",
   "direction": "down",
   "pressing_change_pct": -36,
   "window_min": 3
  }
 },
 {
  "moment_id": "mo_0023",
  "t": 1321.12,
  "clock": 1321.12,
  "minute": 23,
  "type": "long_move",
  "class": 3,
  "score": 0.4,
  "team": "CRV",
  "players": [
   "p_126"
  ],
  "evidence": [
   "ev_000455",
   "ev_000456",
   "ev_000457",
   "ev_000458",
   "ev_000459",
   "ev_000460",
   "ev_000461",
   "ev_000463",
   "ev_000464",
   "ev_000465"
  ],
  "facts": {
   "team": "CRV",
   "passes_in_move": 10,
   "seconds_in_possession": 35
  }
 },
 {
  "moment_id": "mo_0024",
  "t": 1344.82,
  "clock": 1344.82,
  "minute": 23,
  "type": "high_turnover",
  "class": 2,
  "score": 0.52,
  "team": "CRV",
  "players": [
   "p_128"
  ],
  "evidence": [
   "ev_000474"
  ],
  "facts": {
   "player": "Somto Odum",
   "team": "CRV",
   "won_by": "interception",
   "metres_from_goal": 6,
   "turnovers_in_final_third_last_5min": 1
  }
 },
 {
  "moment_id": "mo_0025",
  "t": 1389.06,
  "clock": 1389.06,
  "minute": 24,
  "type": "press_change",
  "class": 3,
  "score": 0.4,
  "team": "CRV",
  "players": [],
  "evidence": [
   "ev_000445",
   "ev_000446",
   "ev_000473"
  ],
  "facts": {
   "team": "CRV",
   "direction": "down",
   "pressing_change_pct": -31,
   "window_min": 3
  }
 },
 {
  "moment_id": "mo_0026",
  "t": 1406.46,
  "clock": 1406.46,
  "minute": 24,
  "type": "hard_pass",